{
  "$schema": "https://json-schema.org/draft/2020-12/schema",
  "$id": "marquee/schemas/palette-payload-v1.json",
  "title": "PalettePayload",
  "description": "Shared contract between Palette Press (producer) and Hue Conductor (consumer).",
  "type": "object",
  "required": ["version", "source", "palette", "pattern"],
  "properties": {
    "version": { "const": 1 },
    "source": {
      "type": "object",
      "required": ["type"],
      "properties": {
        "type": { "enum": ["album", "manual", "test"] },
        "spotifyId": { "type": "string" },
        "name": { "type": "string" },
        "artist": { "type": "string" },
        "year": { "type": "integer" },
        "artworkUrl": { "type": "string", "format": "uri" }
      }
    },
    "palette": {
      "type": "object",
      "required": ["colors"],
      "properties": {
        "colors": {
          "type": "array",
          "minItems": 1,
          "maxItems": 8,
          "items": {
            "type": "object",
            "required": ["hex", "role"],
            "properties": {
              "hex": { "type": "string", "pattern": "^#[0-9A-F]{6}$" },
              "cie_xy": {
                "type": "array",
                "minItems": 2,
                "maxItems": 2,
                "items": { "type": "number", "minimum": 0, "maximum": 1 }
              },
              "role": { "enum": ["primary", "secondary", "accent"] },
              "sourceSwatch": { "type": "string" }
            }
          }
        }
      }
    },
    "pattern": {
      "type": "object",
      "required": ["type", "params"],
      "oneOf": [
        {
          "properties": {
            "type": { "const": "static" },
            "params": { "type": "object", "maxProperties": 0 }
          }
        },
        {
          "properties": {
            "type": { "const": "rotate" },
            "params": {
              "type": "object",
              "required": ["intervalMs", "direction"],
              "properties": {
                "intervalMs": { "type": "integer", "minimum": 100 },
                "direction": { "enum": ["forward", "reverse"] }
              }
            }
          }
        },
        {
          "properties": {
            "type": { "const": "pulse" },
            "params": {
              "type": "object",
              "required": ["periodMs", "minBrightness", "maxBrightness"],
              "properties": {
                "periodMs": { "type": "integer", "minimum": 200 },
                "minBrightness": {
                  "type": "number",
                  "minimum": 0,
                  "maximum": 100
                },
                "maxBrightness": {
                  "type": "number",
                  "minimum": 0,
                  "maximum": 100
                }
              }
            }
          }
        },
        {
          "properties": {
            "type": { "const": "crossfade" },
            "params": {
              "type": "object",
              "required": ["transitionMs", "holdMs"],
              "properties": {
                "transitionMs": { "type": "integer", "minimum": 100 },
                "holdMs": { "type": "integer", "minimum": 0 }
              }
            }
          }
        }
      ]
    },
    "meta": { "type": "object" }
  }
}
