{
  "version": 1,
  "source": {
    "type": "album",
    "name": "kind-of-blue"
  },
  "palette": {
    "colors": [
      {
        "hex": "#144474",
        "cie_xy": [0.19425347778149846, 0.19552037568881878],
        "role": "primary",
        "sourceSwatch": "DarkVibrant"
      },
      {
        "hex": "#B4744C",
        "cie_xy": [0.44759271075858215, 0.38553589231204416],
        "role": "secondary",
        "sourceSwatch": "Vibrant"
      },
      {
        "hex": "#D8B6A2",
        "cie_xy": [0.3594235669295861, 0.35311602953584204],
        "role": "accent",
        "sourceSwatch": "LightVibrant"
      },
      {
        "hex": "#573D30",
        "cie_xy": [0.4018976871192204, 0.3654873691971068],
        "role": "accent",
        "sourceSwatch": "DarkMuted"
      }
    ]
  },
  "pattern": {
    "type": "crossfade",
    "params": {
      "transitionMs": 12000,
      "holdMs": 45000
    }
  }
}
